{
  "SPDX-License-Identifier": "MIT",
  "administrator": {
    "path": "/home/pi/gate-d-inputs/phase5.28-9c408ec493ab/extracted/rp1-gpclk-dkms-0.0.0-phase5.28/scripts/rp1-gpclk-admin.py",
    "sha256": "45d9430bfc3eea6534af3f94ee198da17a22aba9faee2774df8f082ec8bccc10"
  },
  "administratorState": {
    "absenceBeforeInvocation": true,
    "path": "/var/lib/rp1-gpclk-dkms/transactions/0.0.0-phase5.28.json",
    "recoveryPolicy": "invoke-only-for-real-owned-state"
  },
  "argv": [
    "/usr/bin/python3",
    "/home/pi/gate-d-inputs/phase5.28-9c408ec493ab/extracted/rp1-gpclk-dkms-0.0.0-phase5.28/scripts/rp1-gpclk-admin.py",
    "install",
    "--execute",
    "--release-directory",
    "/home/pi/gate-d-inputs/phase5.28-9c408ec493ab",
    "--route",
    "gpio4",
    "--qualification-install",
    "--qualification-identity",
    "/home/pi/gate-d-inputs/phase5.28-9c408ec493ab/gate-d-phase5.28-qualification-install-identity.json"
  ],
  "candidate": {
    "archivePath": "/home/pi/gate-d-inputs/phase5.28-9c408ec493ab/rp1-gpclk-dkms-0.0.0-phase5.28.tar.gz",
    "archiveSha256": "cd7e9d60f603101634d6f81e82edda311b724678c9ce9329ff98609911bcc3d6",
    "release": "0.0.0-phase5.28",
    "sourceCommit": "9c408ec493ab3fc1aa58142592b427faa96c6b4a"
  },
  "cleanupArgv": [
    "/usr/libexec/rp1-gpclk-dkms/gate-d-lifecycle",
    "dispatch",
    "complete-removal",
    "0.0.0-phase5.2",
    "0.0.0-phase5.28",
    "6.18.34+rpt-rpi-2712",
    "/var/lib/rp1-gpclk-dkms/gate-d/bootstrap-phase5.28",
    "--execute"
  ],
  "cleanupPaths": [
    "/var/lib/rp1-gpclk-dkms/gate-d/bootstrap-phase5.28"
  ],
  "deadlineSeconds": 1800,
  "expectedPostState": {
    "dkmsTestVersions": false,
    "endpointPresent": false,
    "liveOutput": false,
    "moduleLoaded": false,
    "overlayActive": false
  },
  "expectedPreState": {
    "dkmsTestVersions": false,
    "endpointPresent": false,
    "liveOutput": false,
    "moduleLoaded": false,
    "overlayActive": false
  },
  "inputFiles": [
    {
      "path": "/home/pi/gate-d-inputs/phase5.28-9c408ec493ab/PROVENANCE.json",
      "sha256": "52c31e6f1cae53b046b5304baa7a79ef38bf61e938b1e21ff866ed44f0bf1e4d"
    },
    {
      "path": "/home/pi/gate-d-inputs/phase5.28-9c408ec493ab/SHA256SUMS",
      "sha256": "b364ded9b872c4cdf6d1dd23cca03a624a07ff39c377b2eb05b512787f851eb1"
    },
    {
      "path": "/home/pi/gate-d-inputs/phase5.28-9c408ec493ab/control-set/docs/evidence/gate-d-phase5.28-qualification-install-identity.json",
      "sha256": "31bbbb751848f576b316edfd83625de2cfc7c452795c984bd0d12753fb5d43c7"
    },
    {
      "path": "/home/pi/gate-d-inputs/phase5.28-9c408ec493ab/control-set/release/gate-c-representative-build-manifest-phase5.28-v1.json",
      "sha256": "321486a0c9a26b0fe74df0bf208e68715e714a106af78b52967eba1d5780872a"
    },
    {
      "path": "/home/pi/gate-d-inputs/phase5.28-9c408ec493ab/control-set/release/gate-d-attempts-phase5.28-v1/gd-corrupted-archive-or-dtbo-archive.json",
      "sha256": "385771b6ad2d4315b202d14c8a6a8696ef4da93cae0ec770b3739b6aa9df1299"
    },
    {
      "path": "/home/pi/gate-d-inputs/phase5.28-9c408ec493ab/control-set/release/gate-d-attempts-phase5.28-v1/gd-corrupted-archive-or-dtbo-gpio20-dtbo.json",
      "sha256": "2ea5f9c3718d962ef473094624534b5a36cbab636eeeb5665ef03fe2c30d3943"
    },
    {
      "path": "/home/pi/gate-d-inputs/phase5.28-9c408ec493ab/control-set/release/gate-d-attempts-phase5.28-v1/gd-corrupted-archive-or-dtbo-gpio4-dtbo.json",
      "sha256": "36ed7701f1f9a8cc1aa9e4445b8c2c7bcee778a43bc31d245e69ab2fee152b8f"
    },
    {
      "path": "/home/pi/gate-d-inputs/phase5.28-9c408ec493ab/control-set/release/gate-d-attempts-phase5.28-v1/gd-current-supported-kernel-gpio20.json",
      "sha256": "cef75a91d6a27065b57443891e441ca20a2bf6b046a5486a6b6777db26d7aa21"
    },
    {
      "path": "/home/pi/gate-d-inputs/phase5.28-9c408ec493ab/control-set/release/gate-d-attempts-phase5.28-v1/gd-current-supported-kernel-gpio4.json",
      "sha256": "ca359998f248bfc729b3a211889a8ccb1d1ba3cd948062798648f39029f58b67"
    },
    {
      "path": "/home/pi/gate-d-inputs/phase5.28-9c408ec493ab/control-set/release/gate-d-attempts-phase5.28-v1/gd-deliberate-build-failure-compiler-wrapper.json",
      "sha256": "f670766f3d3c40a19cdd5af6b70f6e6d6a6374cd4abd22a06e9fa658d049b264"
    },
    {
      "path": "/home/pi/gate-d-inputs/phase5.28-9c408ec493ab/control-set/release/gate-d-attempts-phase5.28-v1/gd-interrupted-upgrade-after-commit-state.json",
      "sha256": "0a7fb88ec39349adaf240631e0aae47a0b2861e7a0193f9ca9e7721487b4b48f"
    },
    {
      "path": "/home/pi/gate-d-inputs/phase5.28-9c408ec493ab/control-set/release/gate-d-attempts-phase5.28-v1/gd-interrupted-upgrade-after-dkms-add.json",
      "sha256": "78e272ab411ca3c2d66b689f2755d02da666cc8a9ff90ba0b4334e7de8483ad9"
    },
    {
      "path": "/home/pi/gate-d-inputs/phase5.28-9c408ec493ab/control-set/release/gate-d-attempts-phase5.28-v1/gd-interrupted-upgrade-after-dkms-build.json",
      "sha256": "1556966b883ee58b2a416a39284dcc797e5f43082507d018e531632a266ae31b"
    },
    {
      "path": "/home/pi/gate-d-inputs/phase5.28-9c408ec493ab/control-set/release/gate-d-attempts-phase5.28-v1/gd-interrupted-upgrade-after-dkms-install.json",
      "sha256": "018daf6389e563d34e00f1bb93772b8609b0e1e57b9995f6fe97c749642e4da0"
    },
    {
      "path": "/home/pi/gate-d-inputs/phase5.28-9c408ec493ab/control-set/release/gate-d-attempts-phase5.28-v1/gd-interrupted-upgrade-after-dkms-remove.json",
      "sha256": "241fce7a3ba43fdf00b2cd8a8512aafd00e3b895ff278c926c6b9e4822146ca0"
    },
    {
      "path": "/home/pi/gate-d-inputs/phase5.28-9c408ec493ab/control-set/release/gate-d-attempts-phase5.28-v1/gd-interrupted-upgrade-after-dkms-uninstall.json",
      "sha256": "16d40c1e6c565a7510e2c6e0366d9353e3371de2ed700a6699c511dc1ec95e77"
    },
    {
      "path": "/home/pi/gate-d-inputs/phase5.28-9c408ec493ab/control-set/release/gate-d-attempts-phase5.28-v1/gd-interrupted-upgrade-after-load-disabled.json",
      "sha256": "078a4a5cafb35a268fcebb1d1380c14ffa28d873cdb4eec6a08e9610f6a54fdb"
    },
    {
      "path": "/home/pi/gate-d-inputs/phase5.28-9c408ec493ab/control-set/release/gate-d-attempts-phase5.28-v1/gd-interrupted-upgrade-after-owned-residue-remove.json",
      "sha256": "7f554a75e67d1a6d4991e16faf09f362a950e8fd4f70a1c7e72a69ff2240cfdc"
    },
    {
      "path": "/home/pi/gate-d-inputs/phase5.28-9c408ec493ab/control-set/release/gate-d-attempts-phase5.28-v1/gd-interrupted-upgrade-after-preflight.json",
      "sha256": "c0837ddb72664867fe2655ebbb19993dcaccbfb140e7ec8567a5d7b40c8f6e58"
    },
    {
      "path": "/home/pi/gate-d-inputs/phase5.28-9c408ec493ab/control-set/release/gate-d-attempts-phase5.28-v1/gd-interrupted-upgrade-after-query-disabled.json",
      "sha256": "6b6e9264bc3a0fd04e0de5d352c837f80cc1292a056b99add9a1cc057b193c4d"
    },
    {
      "path": "/home/pi/gate-d-inputs/phase5.28-9c408ec493ab/control-set/release/gate-d-attempts-phase5.28-v1/gd-interrupted-upgrade-after-retain-predecessor.json",
      "sha256": "b4fb121f05cf6aab7a39c94bfa2b008a3b900cb42a6fb6fa5f99fa336f3f98ae"
    },
    {
      "path": "/home/pi/gate-d-inputs/phase5.28-9c408ec493ab/control-set/release/gate-d-attempts-phase5.28-v1/gd-interrupted-upgrade-after-uapi-query-release.json",
      "sha256": "a3708e59e4cf8e9a841063443258117836ce01102b76ac861d5f07b82c7c464c"
    },
    {
      "path": "/home/pi/gate-d-inputs/phase5.28-9c408ec493ab/control-set/release/gate-d-attempts-phase5.28-v1/gd-interrupted-upgrade-after-unbind-bind.json",
      "sha256": "1d2e5beaa5da38a7e6eeb9a689b88b334c0c7bd3aef54a8828ff86e456bc555a"
    },
    {
      "path": "/home/pi/gate-d-inputs/phase5.28-9c408ec493ab/control-set/release/gate-d-attempts-phase5.28-v1/gd-interrupted-upgrade-after-unload.json",
      "sha256": "6cc0a7bae4bbf5bee313187ab8d51728618e102e638a40c4d4f865547fe5143b"
    },
    {
      "path": "/home/pi/gate-d-inputs/phase5.28-9c408ec493ab/control-set/release/gate-d-attempts-phase5.28-v1/gd-interrupted-upgrade-after-verify-final-state.json",
      "sha256": "1e292aaa704b9927a170f9d48710493d9dfb78320c94504b04ed64cf389fbb78"
    },
    {
      "path": "/home/pi/gate-d-inputs/phase5.28-9c408ec493ab/control-set/release/gate-d-attempts-phase5.28-v1/gd-prior-supported-kernel-downgrade-gpio20.json",
      "sha256": "4d70685855ac8ba23e94c2a929c4d8585db13ac82e4d51d06dcb00fddfd7403c"
    },
    {
      "path": "/home/pi/gate-d-inputs/phase5.28-9c408ec493ab/control-set/release/gate-d-attempts-phase5.28-v1/gd-prior-supported-kernel-downgrade-gpio4.json",
      "sha256": "5ce3619095c67b0aca435175823f2e29809dfa46bf670aec62b1c1c3e8b0067d"
    },
    {
      "path": "/home/pi/gate-d-inputs/phase5.28-9c408ec493ab/control-set/release/gate-d-attempts-phase5.28-v1/gd-reinstall-after-removal-gpio20.json",
      "sha256": "89600ee8217441ea32e7de7d3d380eca9bca250373f8cae2c4c21d9ced0ceb99"
    },
    {
      "path": "/home/pi/gate-d-inputs/phase5.28-9c408ec493ab/control-set/release/gate-d-attempts-phase5.28-v1/gd-reinstall-after-removal-gpio4.json",
      "sha256": "75d60f204c0067683d804ec4f409ec6e682a4e02ab85b31863e8e813c9a5a900"
    },
    {
      "path": "/home/pi/gate-d-inputs/phase5.28-9c408ec493ab/control-set/release/gate-d-attempts-phase5.28-v1/gd-removal-inactive-complete-removal.json",
      "sha256": "e46c7177e0d240c3aa1d3330116ecd433139e0822ee26e7449924f9700744665"
    },
    {
      "path": "/home/pi/gate-d-inputs/phase5.28-9c408ec493ab/control-set/release/gate-d-attempts-phase5.28-v1/gd-removal-open-or-active-open-gpio20.json",
      "sha256": "d5cccb3372c9614bf9467890f26fa28f87919330e3dc5f9778e9f3ec9bc7e42c"
    },
    {
      "path": "/home/pi/gate-d-inputs/phase5.28-9c408ec493ab/control-set/release/gate-d-attempts-phase5.28-v1/gd-removal-open-or-active-open-gpio4.json",
      "sha256": "e4032bd4e93fd805442acf06144c73a91d737c06191656478ad0527aeb73e605"
    },
    {